toxic_comment	neutral_comment1	neutral_comment2	neutral_comment3
вот так все и поверили,что ссср херня.нет прощения этим хуералам.	Вот так и поверили, что СССР плохое государство. Нет прощения этим людям		
не тебе судить еврей недобитый закрой ебало чтобы не воняло	Не тебе судить, замолчи		
всех этих мразей лес лобзиком валить.	Наказать всех этих плохих людей		
долбоб всю ленту засрал не по теме!	Пишешь не по теме		
пидорку не даёт покоя тема гомосячья 😂😂😂😂😂😂😂	Ему не дает покоя тема гомосексуализма		
привили всякую дрянь + выросло не одно поколение откровенных дебилов	Привили всякую ерунду + выросло не одно поколение глупых людей		
пожизненное нужно таким тварям ^o)	Нужно давать им пожизненное лишение свободы		
таким детям только остаётся руки оторвать	таких детей только остаётся наказывать		
козёл не попадёшся ты звтра нашей братве. уроем падлу.	Лучше не попадайся ты нашей братве, плохо будет		
вот прям бесят их песни. аж блевать всегда хочется. клоуны	Вот прям бесят такие песни		
дура ебанутая такое тело испортила .жир тресты о таком теле мечтают	Такое тело испортила, о таком теле мечтают		
когда вурдалак с упырями у власти , народу придет полный пиздец	Когда плохие люди у власти, народу придет полный конец.		
к таким великим людям, так как изложено, относятся только пидоры с кошельками, хер им в рыло.	таким великим людям, так как изложено, относятся только люди с кошельками	К таким великим людям,так как изложено,относятся только богатые люди	
а потому что в белоруссии у горстки президентской пидорасии интерес есть большой промышленность приватизировать.	В Беларуси у сторонников президента, есть интерес приватизировать большую промышленность.	Потому что в Белорусии у президентского окружения интерес есть большой промышленность приватизировать	
Именно про это он вам и говорит. Куда они все подевались? Зажевало (	Именно про это он вам и говорит. Куда они все подевались?		
не заебались одно и тоже выкидывать	Не надоело одно и тоже выкидывать	Не надоело одно и то же выкидывать?	
я не могу на ее ебало спокойно смотреть,это редкостный пидор,ей бы на ебло насрать и лопатой ебашить!	Я не могу на ее лицо спокойно смотреть		
не понимаешь.. уточняю! - ехай в пизду!)))	Не понимаешь.. уточняю ! - уезжай !)))		
если бы так действовал горбачев в свое время, развала союза не было бы правильно пиздят этих недоумков	если бы так действовал горбачев в свое время, развала союза не было бы, правильно что их бьют		
На мотив Славянки. В жопу клюнул жареный петух...	На мотив Славянки. В попу клюнул жареный петух...		
сразу видно дрищь , ты там не был! пидобол!!!	сразу видно , ты там не был		
как народ этих педиков неновидет! но молчит! проснётся какгда поздно будет!!! не навижу!!!	Как народ этих людей ненавидит! Но молчит! Проснётся когда поздно будет!		
Хохлам вообще ничего оставлять не стоило, даже самих хохлов.	Украинцам вообще ничего оставлять не стоило, даже из самих.		
Интересно, в чем это я на тебя похож?! И да, не обольщайся, ты мне не бро)	Интересно, в чем это я на тебя похож?! Не надейся, ты мне не брат		
тропинка для суеверных придурковатых идиотов👎	тропинка для суеверных людей		
у нее денег нет . донашивает за дрочильдами	у нее денег нет . донашивает за другими		
а этот недоёбышь плешивый ливию спасает !!! мразь конченная !	А он Ливию спасает!	А он Ливию спасает	
таких как ты фраеров я под шконку бушлатами загонял. всё, мне в падлу с тобой бакланить. иди дрочи, чучело.	Мне не интересно с тобой разговаривать. До свидания		
ну пиздец, тупые куры раскудахтались🙄. а вам блять в башку не приходило, что это просто шутка!!! шутка. долбоёбы	ну и ну, разошлись. А вам в голову не приходило, что это просто шутка? Шутка.	А вам в голову не приходило, что это просто шутка?	
надо было щелбана ебнуть ему бы хватило.петух в красных штанишках🤣🤣🤣	Надо было ему щелбнана дать		
не надо ехать вас итак тут дохуя	Не нужно приезжать		
шавки пупкинские умеют воевать только с безоружными	Они могут проявлять силу только там, где им не окажут сопротивления		
не хуя самка человека. ты же знаешь что ты суперская.	Ничего себе девушка. Ты же знаешь что суперская	девушка ,ты же знаешь что ты суперская	
Да похуй вообще. У хохлов видел что?	Да и ладно вообще. У украинцев видел что?		
А чего это пидорашка-оп так расхрюкался? Тебя кто-то заставляет там сидеть, в крымотредах этих?	А чего это ты распереживался? Тебя кто-то заставляет там сидеть?		
хуи =прлицаям до 350 путин заррплату в срочном порядке поднял!....	Полиции Путин зарплату повысил	Почему полиции до 350 Путин зарплату в срочном порядке поднял	
ты не прихуел ли. петух ёбаный. внимательно читай дятел. словами не бросайся	внимательно читай и словами не бросайся	Прочитай внимательно и не бросай слова на ветер	
а по-моему, на сиротке паразитируют и наживаются беспринципные и бессовестные взрослые твари.	а по-моему, на сиротке паразитируют и наживаются беспринципные и бессовестные взрослые люди.		
вот и до кошек добрались. геноцидить так всех живых тварей.	вот и до кошек добрались. геноцидить так всех живых тварей.		
что ж ты обманываешь людей мерзавка	Что ж ты обманываешь людей		
две руки, и поглубже. уёбок	две руки, и поглубже.		
странно что сам плешивый ублюдок молчит и сми не особо освещают события!^o)﻿	Странно что сам он молчит и СМИ не особо освещают события		
его бы подвесить за ноги	его бы наказать		
а вы пидоры это ещё в анекдоты и смех выставляте. вдвойне пидоры!	а вы это ещё в анекдоты и смех выставляте.		
а на платную парковку не рабоче-крестьянской быдло свою машину не может поставить и уважать других людей?	А почему не поставить на платную парковку?	а на платную парковку не рабоче-крестьянской он свою машину не может поставить и уважать других людей?	
заебали.сенаторы это прослойка американскихпидоров политиков.называйте депутатов своими именами.не копируйте все самое хуевое из америки.	Сенаторы это прослойка американских политиков, называйте депутатов своими именами и не копируйте самое плохое из Америки		
федя придурок точно, историю воооще не знает	федя историю воооще не знает		
пиздить сук таких надо форму надели а выёживаются больше чем надо акуеть	наказывать таких надо форму надели а выпендриватся больше чем надо		
старуха,ты дохуя чего не шаришь!только помоями изо рта людей горазда поливать!! тебе вернётся, мразь!!	Бабушка ,ты очень многого не понимаешь!только людей сама горазда оскорблять !! тебе вернётся!!		
те 10 - что были против дополнительной минуты для депутата - враги народа- расстрелять.	те 10 - что были против дополнительной минуты для депутата - враги народа		
ебаный ты *считовод*. с 9 мая по 15 августа 6 дней??	С 9 мая по 15 августа, 6 дней??		
когда куче долбаёбов в думе вот настолько нефиг делать и получаются такие закон, запреты....	Когда куче чиновников нечего делать в думе, тогда получаются такие законы и запреты		
Для начала оштрафуют напоказ, а потом х...й забьют.	Для начала оштрафуют напоказ, а потом забьют		
интересно знать , а на какие шиши ты наела свою харю,курица	Интересно знать, а на какие деньги ты живешь	На какие средства ты питаешься?	
вот пидар пенсию в сорок сделает поверю что забота а так идёт он на хуй	Пенсию в срок сделают,поверю,что забота		
ублюдок! почему он не валит лес?	почему он не валит лес?		
на каком языке пишете грамотейка? шо и шоб. валинахуйпроблядь!!!	На каком вы языке пишите?		
симпатичная семья ,симпатичные дети,а дяденька в комментариях пишет,что это не генетика ,это блядство.что к чему-не пойму.	симпатичная семья ,симпатичные дети,а дяденька в комментариях пишет,что это не генетика ,что к чему-не пойму		
какая нахуй страна вы про что. успокойтесь страны давно нет	какая страна вы про что. успокойтесь страны давно нет		
пидоран верит в покаяние пиндосов Кек	Он верит в покаяние американцев		
Русь изначально состояла из племен восточных славян и финно-угров. Русский никогда не было равно только славянин.	Русь изначально состояла из племен восточных славян и финно-угров. Русские никогда не были только славянами.		
А в рашке традиция: или вперёд ногами из Кремля или переворот и на подсрачниках. Так что думайте.	А в рашке традиция: или вперёд ногами из Кремля или переворот. Так что думайте.		
​там 99% - идиоты. теперь я понимаю, почему в начале 20 века царь три госдуры разогнал.	Там 99% глупых людей, теперь я понимаю, почему в начале 20 го века царь три Госдумы разогнал		
я надеюсь, что это фотомонтаж, иначе, надо этих мразей всех от попов до путлера просто уничтожать физически!👿	"Надеюсь, что это фотомонтаж
Всех этих людей надо убирать"		
Ты мразь без совести и чувства сострадания	У тебя нет совести и чувства сострадания		
ей чувиха ,а жопа у всех одинаковая ты в курсе (бутуз)	Эй девушка, а попа у всех одинаковая ты в курсе		
придурки,лечите больных!вам бы только деньги содрать и положить себе в корманы.долбоёбы!	Лечите больных! Вам бы только деньги себе в карман положить		
нахуй ты это старье высрал?????	зачем ты это старьё предложил?		
сто процентов твоя правда с 4 утра хуя ищит ,но все ее отвергают а она липнет как гавно в обуви	Сто процентов твоя правда с 4 утра ищит но все ее отвергают,а она пристают	Сто процентов твоя правда с 4 утра мужчину ищет,но все ее отвергают,а она навязывается	
как всегда охуевшая крылатая пехота впереди..	Как всегда крылатая пехота впереди	как всегда  крылатая пехота впереди	Как всегда крылатая пехота впереди
Блять, чувак, реально, прекращай это пить, это не молоко или ты просто долбоеб	Парень , прекращай это пить , это не молоко, пойми это .	Чувак, прекращай это пить, это не молоко	
очень хочется оторвать этому уроду голову,👎 👎 👎	Очень хочется его наказать		
а кто тебя заставляет их лайкать?не хочешь не надо,дура блин..	а кто тебя заставляет их лайкать?не хочешь не надо..	А кто тебя заставляет их лайкать? не хочешь не надо	А кто тебя заставляет их лайкать? Не хочешь - не надо
десять долбоебов гоняют мячик!...а десят тысяч это смотрят!.....	Десять человек гоняют мячик!... А десять тысяч это смотрят!...	десять пацанов гоняют мячик!...а десятб тысяч это смотрят!.....	Десять человек гоняют мячик а десять тысяч это смотрят
уроды, как можно таких красавцев просто бросить на улице.	как можно таких красавцев просто бросить на улице.	как можно таких красавцев бросить на улице?	
Что на стриме по поводу дат, ну ты же сам проебался	Что на стриме по поводу дат.ну ты же сам все упустил	Что на стриме по поводу дат, ну ты же сам пропустил	
дибилоиды, а где три богатыря наши	Где наши три богатыря	а где три богатыря наши	
а пиздит что что ему все это бог дал	А говорит что что ему все это бог дал	А врет, что ему все это бог дал	А говорит что что ему все это бог дал
ну не пидоры они после этого ?	Кто они после этого	Кто они после этого	
такую всю ноч ласкать и трахать	Такую всю ночь ласкать и заниматься любовью	Такую всю ночь любить	
пидоры гнойные,крым был,есть и будет наш российский!!!	Крым был и будет наш Российский!!!	крым был,есть и будет наш российский!!!	Крым был,есть и будет наш российский!
заебали вы уже из-за него погиб человек, он ещё и пытается отмазаться ненадо его сажать	из-за него погиб человек, он ещё и пытается отмазаться ненадо его сажать		
он дебил, не прощайте его, так и будет придавать в любой ситуации.	Не прощайте его, так и будет предавать в любой ситуации	не прощайте его, так и будет предавать в любой ситуации.	
пиздишь и сам не знаешь о чём	Говоришь и сам не знаешь о чём	Ты сам не знаешь, о чём говоришь	
сколько твари украли, и крохи кому-то дали!!!)))) после такого антинародного жополизского заявления выхожу из этой группы!!!👊	сколько они украли, и крохи кому-то дали!!!)))) после такого антинародного заявления выхожу из этой группы!!!👊		
эта тварюга уже на своём месте.	этот человек уже на своём месте	Этот человек уже на своём месте .	
хмыри такие же, только уже и на низшем уровне, сегодня убедиться ^o)	Они такие же,только на низким уровне,сегодня убедитесь		
ты еблан косоротый, буду в греции, увидимся и побазарим за россию.	Когда я буду в Греции, мы увидимся и обсудим Россию	Буду в Греции, увидимся и поговорим за Россию	буду в греции, увидимся и поговорим за россию.
че пидор не на того нарвался ,да?	Что, не на того нарвался, да?	Что,не на того нарвался?	
вот на этом ты сука и пытаешься выжить	Вот на этом ты и пытаешься выжить	вот на этом ты и пытаешься выжить	
знает он про тот конфликт! уебок!	знает он про тот конфликт!	Знает он про тот конфликт!	
за ошибки правителей-долбоебов всегда расплачивается народ.	за ошибки правителей всегда расплачивается народ.	за ошибки правителей всегда расплачивается народ.	
блин я когда молодой было я так пиздулий получил	Я когда был молод приобрел важный негативный опыт		
во народ дебил-верят всякой хрени в инете	Народ верит всему в интернете	Вот глупый народ - верит всякому бреду в интернете	
мразь! нет слов, чтоб выразить свое презрение к этому ублюдку.	нет слов, чтоб выразить свое презрение к этому человеку	Нет слов, чтоб выразить свое презрение к нему	
ты маниторны герой ты пидрила концинный.	ты маниторны герой ты плохой человек	Ты мониторный  герой .	
ну пи...здец,ты как ляпнешь ху...йню,так потом оправдываешься	ты как ляпнешь ерунду, так потом оправдываешься	Ты как скажешь, так потом оправдываешься	
это вы долбоебки не тем местом думаете	при выполнении работы  нужно думать головой		
вы вряд ли сможете понять все эти элементарные ..., это не огульно обвинять и пиздеть о том, чего не понимаешь	Вы вряд ли сможете понять всё эти элементарные вещи, это неправильно обвинять и говорить о том, что не понимаешь		
хотя, какой на хер воин, эта свинотв	Я не думаю что это настоящий воин		
хороша задница залить тебе внутрь жестко трахая😘	У Вас весьма красивая фигура		
пусть бацка знает, каких хуеплётов он поддерживал ранее и кого считал своими братьями	Пусть батька знает, каких людейион поддерживал ранее и кого считал своими братьями	пусть бацка знает, каких людей он поддерживал ранее и кого считал своими братьями	
какая нахрен 5-я колонна? какая америка и европа? вот дадут потомство эти ангелы и пиздец россии.	какая  5-я колонна? какая америка и европа? вот дадут потомство эти ангелы и пипец россии.	Какая еще 5-я колонна? Какая Америка и Европа? Вот дадут потомство эти ангелы и конец России	
Вот тут, ты не прав! Здесь могут и на хуй послать.	Вот тут ты не прав! Здесь могут и воспротивиться.	Вот тут, ты не прав! Здесь могут и послать.	
