toxic_comment	neutral_comment1	neutral_comment2	neutral_comment3
и,чё,блядь где этот херой был до этого со своими доказательствами?	Ну и где этот герой был,со своими доказательствами?	Где этот герой был до этого со своими доказательствами?	и,где этот герой был до этого со своими доказательствами?
О, а есть деанон этого петуха?	О, а есть деанон		
херну всякую пишут,из-за этого лайка.долбоебизм.	Чушь всякую пишут, из- за этого лайка.	Ерунду всякую пишут,из-за этого лайка.	
из за таких пидоров мы и страдаем	из за таких плохих людей мы и страдаем	Из-за таких людей мы и страдаем	из за таких как он мы и страдаем
гондон путинский он а не артист	Человек Путина он, а не артист		
как урод такую херню пишет???	кто такую ерунду пишет		
в гсвг за такие сапоги пиздюлей получил бы от сослуживцев	В ГСВГ за такие сапоги наказали бы сослуживцы		
Скудоумие это свойство личности проявлять умственную ограниченность. И где здесь обзывание?	Слабоумие это свойство личности проявлять умственную ограниченность. И где здесь обзывание?		
Спасибо! Потому что предвзятость модераторов начинает напрягать - модерируют как бык поссал.	Спасибо! Потому что предвзятость модераторов начинает раздражать-модерируют спустя рукава.	Спасибо! Потому что предвзятость модераторов начинает напрягать.	
У меня бывает говорение о себе в 3-м лице... А может это шизофрения, кто знает?)	У меня бывает говорение о себе в 3-м лице... А может это шизофрения, кто знает?)		
Он про марихуану и вообще дуй отсюда, пока твой батя новый аккаунт не спалил.	Он про марихуану и вообще иди отсюда пока твой батя новый аккаунт не спалил		
слышишь тыпиздед! что то вы помощники россии не едите жить в деревню, а прёте в города!	Что же вы помощники России не едите жить в деревню, а все в городе едите?	Что-то вы, помощники России,  не едете жить в деревню, а живете в городах	
ну и выродки,это твой ребёнок,зачем ты сучка рожала.	ну и люди,это твой ребёнок,зачем ты рожала.		
людям нам тоесть что выбросов нет вешают людям машиной якобы какой то контроль держат ничего козлы не контролируют	Людям нам то есть что выбросов нет вешают людям машиной якобы какой то контроль держат ничего не контралируют		
позорник кадони поддержал зажравшегося меньщикова... без команды боится ребят поддержать и поставить придурка на место...	Кадони поддержал меньшикова. Без команды боится ребят поддержать и поставить его на место.		
сергей алонцев а ты приедь ко мне в гости на дальний восток чёрт ёбанный сам услышиш	сергей алонцев а ты приедь ко мне в гости на дальний восток  сам услышиш	Сергей алонцев а ты приедь ко мне в гости на дальний восток сам услышишь	
Почему у росгвардейца гибддшная палочка?	Почему у росгварлейца полицейский жезл?		
мы всегда лучше вас жили и живём . черти вы ебанные . иди жопу мой ванючка	мы всегда лучше вас жили и живём		
какой нахрен вид на жительство,он пид)р визу показывает,чтоб резиденцию испанскую получить надо 3.5 года прожить или недвижимость дорогую купить	какой еще вид на жительство? он визу показывает,чтоб резиденцию испанскую получить. надо 3.5 года прожить или недвижимость дорогую купить	какой  вид на жительство,он  визу показывает,чтоб резиденцию испанскую получить надо 3.5 года прожить или недвижимость дорогую купить	Какой вид на жительство? Он визу показывает, чтоб резиденцию испанскую получить, нужно 3,5 года прожить или недвижимость дорогую купить
ну дебил..что с таким чмошником говорить...тебе не на запад..тебе у куев надо..там для тебя все свои будут	О чем с тобой говорить, тебе не на запад надо, а в Киев ...там для тебя все свои будут		
жириновский чертовски прав! не светская львица, а блядь, отгодайте в этом случае кем является блогер?	жириновский чертовски прав! не светская львица, а плохая женщина, отгодайте в этом случае кем является блогер?	Жириновский чертовски прав! Не светская львица, а девушка лёгкого поведения,отгодайте в этом случае кем является блогер?	
Не пытайся меня понять. Не напрягай свои зачатки интеллекта.	Не пытайся меня понять, все равно не поймете		
зато его урода лправдывают, а людей невиных гнобят.купленые и судьи и адвокаты.твари.	Зато его оправдывают ,а людей невинных обижают ,купленные судьи и адвокаты		
идиоты безголовые, ...бог всё видит, бумеранг существует,...ходите и оглядывайтесь уроды	Бог всё видит. Каждый будет отвечать за свои дела.		
одного не пойму это насколько надо быть быдлом чтобы у стариков отбирать последнее и отправлять на грабленное домой.твари.	"Одного не пойму это насколько надо быть бесчеловечными,чтобы у стариков отбирать последнее и отправлять награбленное домой ,
.плохие люди"	одного не пойму это кем надо быть, чтобы у стариков отбирать последнее и отправлять награбленное домой.	
биба и боба - два долбоёба! один снимает - другой погибает!	Два друга!один снимает другой погибает		
какая гадость... уничтожать на корню, эту заразу...	Какая гадость... уничтожать на корню, эту болезнь		
я вообще ничего не писала, а вот ты постоянно пишешь, что там сука, давай, доказывал	я вообще ничего не писала, а вот ты постоянно пишешь, что там , давай, доказывал	Я вообще ничего не писала, а вот ты постоянно пишешь, что там , давай, доказывал	
посадить бойцов в кузов им точно пизда	Посадить бойцов в кузов им вероятно не сдобровать	Посадить бойцов в кузов, и им тогда точно будет плохо.	
Сидела задумалась как заебала её эта никчёмная жизнь.	Сидела задумалась как надоела ей её эта жизнь.	Сидела задумалась как надоела эта жизнь	
получается учитель тупой, исправленного отчества не существует! владиморович	Получается учитель не умный,исправленного отчества не существует!Владимирович	Получается учитель неграмотен, исправленного отчества не существует! Владиморович	
давно пора и надо установить доску позора куда вывешивать фото этих уродов которым плох когда другим хорошо...народ должен знать своихгероев!	давно пора и надо установить доску позора куда вывешивать фото этих людей которым плохо когда другим хорошо...народ должен знать своих героев!	давно пора и надо установить доску позора куда вывешивать фото этих людей, которым плохо когда другим хорошо...народ должен знать своих героев!	
кто голосует за афганскую борзую ,вы ебанулись чтоль,пройдите в себе,знатоки породы,бляяяя	кто голосует за афганскую борзую ,пройдите в себе,знатоки породы	Кто голосует за афганскую борзую, пройдите в себе, знатоки породы	
, Если модеры сочтут удалить, да в чем проблема то?	Если модераторы решат удалить, да в чем проблема то?		
хуй знает кто кум, но девушка красивая👍	Не знаем кто кум,но девушка красивая	неизвестно кто кум, но девушка красивая	Не знаю кто кум, но девушка красивая👍
аты блять что не хохляр, пиндоская.!	Вы разве не украинец?		
У ТЕБЯ ЕСТЬ ПРАВА НА ЗАРПЛАТУ ПО УКАЗАМ ПУТИНА, НО Т ТЯ СРАКА ТЕБЯ ОБМАНЫВАЕТ, НЕ ВЫПОЛНЯЯ УКАЗЫ САМОГО ПУТИНА!	У тебя есть права на зарплату по указам Путина, но она тебя обманывает, не выполняя указы самого путина		
уроды, а завтра лука приедет опять просить невозвратный кредит..	А завтра лука приедет опять просить невозвратный кредит		
Только вот вся семья его живет в рашке и всех их перевезти не варик	Только вот вся семья его живёт в России и перевезти их всех не вариант.	Только вот вся семья его живет в Росии и всех их перевезти никак	Только вот вся семья его живет в рашке и всех их перевести не вариант
ты идиот я разговор веду и незакого нерешаю еще один агресивный чувырло вот так все и начинается	я разговор веду и незакого нерешаю еще один агресивный человек вот так все и начинается		
не нравится сука???а что же ты народы стравливаешь мразь ???....	Не нравится? Что же ты народы ссоришь		
что, гандон, сжалось очко ? чс ? алаверды.	Что, испугался? Чс? Алаверды		
да по хуй сука пол страны синька чемо.и не хуя молчат.одна кокая мразота известная пережрала водки так пиздец катострофа	То что пол страны пьют-всем все равно, молчат. А как кто из знаменитостей напьётся-так катастрофу из этого делают.		
этих сволочей надо расстрелять за жестокое обращение с животным!	Этих людей нужно наказывать за жестокое обращение с животными!		
это как так же воспитывают что девочки уже трахаються во всю?) сильно слов нет	Это как так же воспитывают что девочки уже спят во всю? Сильно слов нет	Это как же так воспитывают, что девочки вовсю живут половой жизнью? Слов нет совсем	
такого пидораса ещё небыло и не будет за всю историю россии русской.	такого человека  ещё не было и не будет за всю историю россии русской.		
37 вылетов за 10 минут!!!!! сосите жопу твари	37		
потомушто долбоебы, зато щас разнообразного хлама полно	Потому что не в себе, зато сейчас разнообразной ерунды полно		
пидор, какой еще координационный совет, который представляет горстку кретинов, стремящихся развалить свою страну?	какой еще координационный совет, который представляет горстку людей, стремящихся развалить свою страну?		
ты чё пидор усатый против нас имеешь?	ты что против нас имеешь?		
а потом долбоёбы на дорогу лезут после таких автошкол	А потом на дорогу лезут после таких автошкол.	а потом на дорогу лезут после таких автошкол	
хороших людей забирает, а хуйню оставляет, взяточников,	хороших людей забирает,а взяточников оставляет		
давно пора такой закон ввести. эта тварь отсидит и снова выйдет и снова будет с.....ка насиловать и убивать.	Давно пора такой закон ввести, этот человек отсидит и снова возмется за старое		
шакалы. волк и то кости оставляет.	Волк и то кости оставляет		
мне нравится! натали вашу ебучую группу качает, а вы бляяяя марамойки дешевые:d :d :d :d 👎	мне нравится. натали вашу группу качает, а вы не очень стараетесь		
ебанутые савсем уже стали сосваим вирусом уже не знают че придумать. пердеть тоже корновирус.	Со своим вирусом уже не знают че придумать.Пукать тоже коронавирус.		
ну и тварь эта гадина её покарает господь хороших родитетей тебе малышка🥰	Ее покарает господь. хороших родителей тебе малышка		
да,блядь,правильно,но серебряков с этим афоризмом уже заебал!	Да, правильно, но Серебряков с этим афоризмом уже надоел	Правильно, но серебряков с этим афоризмом уже надоел	правильно,но серебряков с этим афоризмом уже надоел
да вообще похуй сколько этот долбоеб получает	да вообще все равно  сколько он получает	Мне всё равно сколько он получает.	
все людей наебала ,а потом же , что бы деньги не отдавать , ты начинаешь хуйню писать !!	Всех людей обманула а потом же, чтобы деньги не отдавать, ты начинаешь чушь писать!!	Все людей обманула, а потом же,что бы деньги не отдавать, ты начинаешь ерунду писать	
вот из-за таких пидорасок,, простите девочки и,, семьи распадаются	Вот из-за таких, простите девочки и, семьи распадаются	вот из-за таких легкомысленных особ, простите девочки, и семьи распадаются	
у тебя и задевать то нечего, ебланка.	у тебя и задевать то нечего, девушка		
а сколько блядь они нам должны ни слова только мы им должны твари ненастные	А сколько они нам должны ни слова только ,мы им должны	А о их долгах ни слова, только мы должны	
и таких уродов не мало	таких много	И таких не мало	
б расстрел митинга в новочеркасске gать	расстрел митинга в новочеркасске		
он тащит электропоезд, а там контактной сети нет.дибил	Он тянет электропоезд, а там контактной сети нет.	Он тащит электропоезд, а там контактной сети нет	он тащит электропоезд, а там контактной сети нет.
да вот совсем насрать какая у него национельность	все равно какая у него национальность	да вот совсем без разницы какая у него национальность	да вот совсем без разницы какая у него национельность
А ей хочется араба или ниггера...	А ей хочется араба или афроамериканца	А ей хочется встречаться с арабом или афроамериканцем...	
без крыльев то какой мудак ездит!	без крыльев то кто ездит!		
Прочитай все, что я написал, если не поймешь, прочитай еще раз, потом подумай, потом пиши.	Прочитай все, что я написал, если не поймёшь, прочитай ещё раз, потом подумай, потом пиши.		
те в рот дает азером шлюхам сосать молчи не скули пдар	молчи и не жалуйся		
причём тут образование сосёт она однако хорошо насосала на генерала	Вопрос в том,как она стала генералом?		
говорила ли эта мразь такие слова?	Говорила ли она такие слова	говорил ли этот человек такие слова	
и всё это пренадлежит дипутатам бандюгам пидорасам	и всё это пренадлежит дипутатам	и всё это пренадлежит дипутатам	
Не понимаю Вашу речь, к счастью.	Не понимаю Вашу речь, к счастью.		
у тебя что, ИНТОКСИКАЦИЯ УКРАИНСКИМ МИРОМ?	У тебя перенасыщение украинским миром		
блядь !!!полный беспредел ,прям в начале сезона,бомжы вы че совсем что ли прихуели!?!?!?!?	Полный беспредел, прямо в начале сезона, вы что совсем что-ли с ума сошли		
долбоёбка, пидаросия уже 6 лет снабжает ордло оружием, боеприпасами, гсм и боевиками.	Россия уже 6 лет снабжает ордло оружием, боеприпасами, гсм и боевиками.		
за деньги куда хочешь выйдут. дебилы!	За деньги они куда угодно пойдут. Не умные люди.	За деньги куда хочешь выйдут	
Да хз, что ты до меня то докопался ?	да что ты до меня докопался?		
не надо этим уродам подсказывать- какой -то чиновник увидит и хана- так и будет )	Не надо нашим чиновникам нечего подсказывать. Увидят и нам плохо будет.		
на хуя такое выкладывать, зто и дети будут смотреть долбоебы	Зачем такое выкладывать, это и дети будут смотреть	Зачем такое выкладывать, это и дети будут смотреть	
тварь присягу один раз,а проебал всю страну	Присягу дал один раз, а разрушил всю страну		
правительство дешёвка коньченные 😡 жалко им детей накормить. зато сами жируют твари ебаные.	Правительству жалко детей накормить, а сами зато на широкую ногу		
админы вы долбаебы как вы заебали плюсони плюсони на всякую хуйню	Админы, вы уже надоели плюсони плюсони на всякую ерунду.		
а ты читать умеешь или дерьмо из жопы прёт в глаза ? тихаботка ты	А ты умеешь вообще читать?		
боюсь ей это даже понравиться)) по ней видно что блять еще та.....	Боюсь ей это даже понравилось, по ней было видно	Боюсь ей это даже понравиться )) по ней видно что ещё та	
люди не в материться надо дох я русском языке других пездатых слов	Люди, не надо материтьсяу нас так много красивых слов		
какую хуйню вы порете с телеэкранов, вауу, это пиздец, чтобы в это верить нужно быть полным уебаном	Какую глупость вы говорите с телеэкранов, вауу, это надо же верить в такое		
20 лет шли в перёд а оказались в жопе	Двадцать		
путин пидар ебанный уходи в отставку.	Путин уходи в отставку		
так это у нас, будет, может быть, когда нибудь, вдруг. а ты вчера сосал, сегодня сосешь и завтра сосать будешь.	Так это у нас ,будет ,может быть ,когда-нибудь	Вдруг когда-то так у нас будет, а ты как жил, так и будешь, и ничего в твоей жизни не изменится	
