toxic_comment	neutral_comment1	neutral_comment2	neutral_comment3
И посмотри чьих дидов погибло в WOW больше всего и это будут хохлы, русня и белорусы	И посмотри чьих дедов погибло в вов больше всего, скорее всего это будут украинцы, русские и белорусы		
мразь ебаная, не ордло, а днр и лнр	Не ордло, а днр и лнр		
Дебилы бля, гугл на этой хуйне обучает нейросетку для автопилотов	гугл с помощью этой штуки обучает нейросетку для автопилотов	гугл на этом обучает нейросетку для автопилотов	
обсерают сидят этих уродов по кайфу вам дебилаи	Оскорбляют сидят всех и им это нравится		
где ж ты, блядь, такая дура то нашлась?????	где ж ты такая нашлась		
сейчас соотношение (зарплата-цена) не адекватно, олигархи жыруют, а пахари сельские в основном хуй сосут.	Сейчас соотношение зарплата-цена не одекватно, олигархи шикуют, а пахари в основном бедствуют		
и везде вас отпиздила армянская диаспора	и везде вас победила армянская диаспора		
Рашка таки скатилась в сраное говно	Россия свернула не в ту сторону		
вот таким образом появляются новые законы ,отстреливать как бешеных собак!	вот таким образом появляются новые законы!		
хрень овертоновская, перефраз завуалированный-лишь тот достоин жизни и свободы, кто каждый день идёт за них на бой	Ересь овертоновская, перефраз завуалированный - лишь тот достоин жизни и свободы, кто каждый день идёт за них на бой	перефраз завуалированный- лишь тот достоин жизни и свободы, кто каждый день идёт за них в бой	
а тогда хрен соси как мишка лапу,честно в нашей стране заработать такие деньги не реально.	Честно в нашей стране заработать такие деньги нереально	Честно в нашей стране заработать такие деньги не реально	
долбоебы!!!я за последний год собрала столько справок,ебнуться можно,ноги до жопы стерла!!!	Я за последний год собрала столько справок,обалдеть,ноги,чуть не до головы стерла..		
таких уродов необходимо уничтожать на месте и не церемониться	Таких людей необходимо наказывать на месте и не церемониться		
гнать этого старого козла в дряблую шею!	Прогнать его нужно		
ебарь твой тебя кинула да, наркоманка?)	Парень твой тебя бросил, да?		
сначала хуй предоставьте, а там посмотрим)	Сначала доказательство предоставьте, а там посмотрим)		
То-то столько Сколько? Пукаешь в воздух в попытке оправдать пидорашенскую пиздецовскую реальность - это просто смешно	То-то столько Сколько?Портить воздух в попытке оправдать реальность-это просто смешно		
ты только не стони от удовольсвия пидорок..	ты только не стони от удовольствия		
сожрут его и хрен с ним.	Съедят его,ну что ж теперь..		
как сказал умный аж страшно только после этих слов на кол суку	Как сказал умный аж страшно только после этих слов на кол		
эту рыжую крысу чубайса уже давно не видно нигде	этого чубайса уже давно не видно нигде		
ты, чмошница, живи, как хочешь, ебись с кем хочешь, чувырла гребанная! скоро получите, что хотите! вперёд на майдан!!!	Ну и живи, как хочешь, скоро получите, что хотите! Вперёд на майдан!!!		
товарищ задержанный комиссар говорит что депутатская у него неприкосновенность расстрелять и прикасаться не	Товарищ задержанный комиссар говорит, что депутатская у него неприкосновенность		
да вы пидры нашли о чем пиздеть:-d﻿:-d﻿два философа,сууукаа:-d﻿:-d﻿:-d﻿	Да вы нашли о чем говорить, два философа		
дебилы пишут, только для кого народ и так давно прозрел	Для кого они пишут? Народ и так давно прозрел.		
и ихние ублюдки будут прекрасно жить	И ихние потомки будут прекрасно жить	И их люди будут прекрасно жить	
ну и родителям пидорасов тоже повезет.	ну и родителям этих плохих людей тоже повезет.		
не надо говорить о себе во множественном числе, чмо не доделанное.	не надо говорить о себе во множественном числе		
иди мимо если не нравится хули коментируешь мокрошелка ебучяя	Иди мимо если не нравится, что комментируешь		
одноногий пидорас шамин, пидорас - это ты	Вы ли это инвалид без ноги по фамилии шамин		
где ты там русских баб то углядела??)))явные корейские пиздоглазки))(	Где ты там русских девушек увидела? Явно корейские		
- Аватаркоблядством: прикрепляет к своим сообщениям совершенно нетематические арты по MLP, фото вышеуказанной кавхоры	- Аватаркоблудием: прикрепляет к своим сообщениям совершенно нетематические арты по MLP, фото вышеуказанной интернет-модели	Прикрепляет к своим сообщениям совершенно нетематические Арты по MLPфото вышеуказанной кавхоры	
вообще, сука, очень везучий по жизни знак, что несолько компенсирует постоянное отсутствие у него бабла	вообще очень везучий по жизни знак, что несколько компенсирует отсутствие у него денег	вообще, очень везучий по жизни знак, что несолько компенсирует постоянное отсутствие у него денег	
ебнутый откуда у нас такие деньги вы в оличее от вас не воруем	откуда у нас такие деньги вы в отличие от вас не воруем		
таких руководителей необходимо на кол за их воровство бандитизьм жульничество.	таких руководителей необходимо наказывать за их воровство бандитизьм жульничество.		
сказала охуевшим продавцам, что трахаюсь без гандонов и пошли бы вы со своими масками в очко 😅😅😅	сказала продавцам, что не использую презервативы и маску одевать не буду		
а микроскоп им в помощь этим дибилам	а микроскоп им в помощь		
или нах,й барсадрочер вы просрали матч	Вы проиграли этот матч ,идите своей дорогой		
долбаебы наркомана конченного сравнивают с бандитом	наркомана нельзя сравнивать с бандитом		
в армейке таких трахали за каждым углом	в армейке над таких постоянно издевались		
уж точно мокрого места от него не осталось бы мерзкая тварь	уж точно мокрого места от него не осталось бы		
если не блять то смени фото путний мужик на это не купится	Если нормальная женщина, то смени фото, путевый мужик на это не купится		
отсосинка голубкова, ты уже показала какая ты идиотка, может хватит	голубкова, ты уже показала свои способности, может хватит		
что делают деньги? почему сука таких защитников не судят?	Что делают деньги? Почему таких защитников не судят		
Сука, как же я обосрался с этого шерлока, до слёз блять	Как же я удивился с этого шерлока, до слез		
ты что хохлоблядь не знаешь, что ваша мова это сленг польских холопов	Ты что не знаешь, что ваш язык - это польский сленг		
ты что сука хочешь науськать нашу молодежь на протесты против власти и отправить их на бойню	Ты хочешь нашу молодёжь отправить на протесты против власти?	Ты что хочешь науськать нашу молодежь на протесты против власти и отправить их на бойню	
мразь пиздит , именно пиздит а не врёт скатина .а парень красавчик молодец .так их сук.	Она врёт, а парень молодец		
он думал что машина не давит поделом дебилу	Он думал что машина не давит по делом ему		
пидорасы , отвезли бы детям в дет.дома , старикак в интернаты ....	отвезли бы детям в дет.дома , старикак в интернаты ....		
А мразота продолжает устанавливать свои тоталитарные порядки	власть продолжает устанавливать свои тоталитарные порядки	нехорошие люди продолжают устанавливать свои порядки	Этот человек продолжает устанавливать свои тоталитарные порядки.
найти этого мужчину и оторвать ему его потряхушки	Найти этого мужчину и наказать	Найти этого мужчину и наказать его.	
хуетень а не видео,сочувствую пострадавшим 🙈.	Ерунда, а не видео, сочувствую пострадавшим.	Мне не нравится это видео сочувствую пострадавшим	
читая твои гнусные писульки видно, что ты образован, наверное имеешь высшее образование, а может и не одно	Читая твои записи видно, что ты образован, наверное, имеешь высшее образование, а может и не одно		
молодцы ребята, быстро и оперативно задержали ублюдков.	молодцы ребята, быстро и оперативно задержали.	Молодцы ребята, быстро и оперативно задержали преступников	
а что ты это так жопу рвать за нее начал?	а что ты это так стараться за нее начал?		
Но потоогике жить а Рашке он не может	но по логике жить в России он не может		
ты же сука видишь что происходит,,, сибирячка,,, хуева	Ты видишь что происходит сибирячка	Ты же видишь что происходит	
Ладно блядь я, мне 34, ей 35, но он-то куда	Ладно блин я, мне 34, ей 35, но он то куда	Ладно я, мне 34, ей 35, а он то куда	
ну и нахуя так делать,админ,ты же взрослый чел,убери эту муть, 😆	Зачем так делать администратор убери это		
а значит, тебе, тварь, и возразить то уже нечем	Возразить то уже нечем	А значит тебе и возразить уже нечем?	А значит тебе и возрозить то уже нечем
Мне бы понравилось жить со шлюхой.	Мне бы понравилось жить с дамой легкого поведения		
ага размечтался,сидит урод умничает.не хрена не делают только дибильные законы принимают.надоели!!!!!!!!	Ага размечтался сидит умничает ничего не делает только какие то законы принимают надоели	Политики ничего не делают и принимают только плохие законы	ага размечтался,сидит умничает. ничего не делают только плохие законы принимают.надоели!!!!!!!!
зла блядь не хватает, читая этот бред....	Зла не хватает, читая этот бред	Невыносимо, читать этот бред	
такие уроды во все времена были не только в путинские	Такие люди во все времена были не только в путинские	такие во все времена были не только в путинские	Такие плохие люди были во все времена
А она не с рождения приближается? ЧТО ЗА ХУЙНЯ???	А она не с рождения приближается? Что за ерунда?		
долбаебы вы со своими протестами наплачетесь	Вы со своими протестами ещё наплачетесь.		
Пятеро детей, но отец и мать всю жизнь дули в жопу самому младшему	Пятеро детей, но отец и мать всю жизнь любили самого младшего	Пятеро детей, но отец и мать всю жизнь уделяли время самому младшему	Пятеро детей, но отец и мать всю жизнь любили самого младшего
вот ребята что делают деньги у негопидора совести не хватает признать себя виноватым трус и подонок	Вот что делают деньги если не хватает совести признать себя виноватым		
пидор этот капитан, на основании чего он выебывается?	Не хороший этот капитаг, на основании чего он так вызывающе себя ведет?		
интересно дети её знают что её называют соска конченая , проститутка .	интересно дети её знают как её называют		
то есть нормально трахаться на стороне, когда состоишь в отношениях?	то есть нормально изменять на стороне, когда состоишь в отношениях?	то есть нормально изменять на стороне, когда состоишь в отношениях?	То есть нормально встречаться с другим на стороне, когда ты уже состоишь в отношениях
вы суки, когда уже перестаните этой хуйней заниматься? если денег до хрена отдай ты у кого его нет	вы ,когда уже перестаните этим заниматься? если денег много отдай ты у кого его нет		
свой тyпoй выхлоп можешь свернуть в трубочку и задвинуть себе в место, которым думаешь...то есть в жопу	Замолчи.		
хз кто правду пишет, но у парня еблет реально мерзкий	Не знаю кто правду пишет но у парня лицо не приятное		
У укровоинов дэнь защитника витчызны 14 октября.	У украинских солдат день защитника витчызны 14 октября.		
а ваз это уебище не обогнать не в аварии выжить	а ваз не обогнать не в аварии выжить	А ВАЗ это самая плохая машина. Не обогнать, ни в аварии выжить	
и что этого пидора не отпорол никто???	И что его никто не наказал?		
Обратите внимание, какой он ультрабыдлан, в конце говорит: Умываться - для педиков	Обратите внимание, какой он! В конце говорит: умываться не для мужчин		
продажные твари опять хотите в 90-е	Опять хотите в 90-е?	Опять хотите в 90-е	
.что вы твари безродные делаете????дак и киев уже переименуйте назовите жопа😡	Что ж вы делаете? И  Киев тогда уже переименуйте!		
надо быть таким дебилом как ты,чтобы этого не видеть,либо быть в этом заинтересованным..	Это каким надо быть человеком чтобы это не видеть либо быть в этом заинтересованным		
с этой фразой я стал ненавидеть это хуйло.и как показало время я не ошибся	После этой фразы я разочаровался в нём. И время показало, что я был прав.	с этой фразой я изменил свое отношение к нему.и как показало время я не ошибся	
хуй знает что это это долбоеб написал слыхал дзвин а не знает где вин	Незнаю что он написал.слыхал звон да не знает где он		
остаётся это дерьмо смыть в унитаз.	Придётся это смыть в унитазе.	Остаётся всё смыть в унитаз.	
А вот и отсылочки к фильмам для дегенератов подъехали	А вот и отсылки к фильмам начались	А вот и отсылочки к фильмам подъехали	
стыдно за дебилов которые такое придумывают!!!!!!!!	стыдно за таких которые такое придумывают		
Уже шлюх и то по интернету, с отзывами ищут	Уже барышень легкого поведения и то по интернету, с отзывами ищут		
украинская пидрильно -либеральная схема ..юным добилам на карту по 10 евро за выход на митинг кидают .	Демонстрантам из Украины за выход на митинг платят по 10 евро на карту	Украинская либеральная схема молодежи на карту кидают по 10 евро за выход на митинг	
пидоров и прочих фриков он что-то не очень то любит	гомосексуалистов и прочих представителей меньшинств он что-то не очень то любит		
ну что поделаешь, пидоров везде хватает.	ну что поделаешь, таких везде хватает	Ну что поделаешь, таких везде хватает	
белоручек и долбоёбов, ими легче управлять.	белоручек, ими легче управлять.		
а этому гражданину все по хуй клал он на всех нас	а этому гражданину все равно клал он на всех нас	А этому гражданину всё равно на нас на всех	Этому гражданину безразлично
слышь , косоглазова! мне похер конечно что ты тут прописалась и косишь под русских	Слушай, Косоглазова, мне всё равно на то, что ты здесь прописалась и стала русской.		
а рефери то где, вообще мудак !	А рефери-то где, вообще ни о чём!	Где рефери?	
Ну а что такого то? Ясен хуй если он завел трактор то особой любви к рашке он не испытывал	Ну а что такого то? Понятно если он завел трактор то особой любви к России он не испытывал.	Ну а что такого-то? Ясно, если он завёл трактор, то особой любви к России он не испытывал	
такие же пиздаболы как и они	вы такие же как и они		
хм, я бы ей маршала дал) а ты соси!)	Я бы ей маршала дал, а тебе нет		
Ну не прямо сразу же ватан бросился к своему кредитному ноутпуку	Не сразу же он бросился к своему ноутбуку		
ну не любят в россии пидарасню если	Не любят в России таких людей		
что пиздеть то ну видно же что не настоящая	Что врать то, ну видно же что не настоящаяя	зачем врать то ну видно же что не настоящая	
обосрала машину ещё и наверное шум гам устроила..	Раскритиковала машину ещё и шум устроила	испортила машину ещё и наверное шум гам устроила..	
-да, правда? и чем же? да так же пидор занял место и никому не уступаешь..	-да, правда? и чем же? да так же  занял место и никому не уступаешь..		
ничего удивительного, что можна ждать от ебанутых.	ничего удивительного, что можно ждать от этих людей.	ничего удивительного, что можна ждать от неадекватных людей	
страна,так называемый агрессор все это решит,и вас,хохлоуебков,даже не спросит.	Страна , так называемый агрессор все это решит и вас даже не спросит		
